{
  "$schema": "http://json-schema.org/draft-07/schema#",
  "title": "Evidence Gate Reviewer Receipt",
  "type": "object",
  "additionalProperties": false,
  "required": [
    "schema_version",
    "event_type",
    "receipt_id",
    "generated_at",
    "action",
    "decision",
    "verification",
    "trace_chain",
    "complete"
  ],
  "properties": {
    "schema_version": {
      "const": "pythia.openhands.evidence_gate_receipt.v0.1"
    },
    "event_type": {
      "const": "evidence_gate_receipt"
    },
    "receipt_id": {
      "type": "string",
      "minLength": 1
    },
    "generated_at": {
      "type": "string",
      "format": "date-time"
    },
    "action": {
      "type": "object",
      "additionalProperties": false,
      "required": [
        "action_event_id",
        "tool_call_id",
        "tool_name"
      ],
      "properties": {
        "action_event_id": {
          "type": "string",
          "minLength": 1
        },
        "tool_call_id": {
          "type": "string",
          "minLength": 1
        },
        "observation_event_id": {
          "type": [
            "string",
            "null"
          ]
        },
        "tool_name": {
          "type": "string",
          "minLength": 1
        },
        "action_summary": {
          "type": [
            "string",
            "null"
          ]
        },
        "final_artifact_refs": {
          "type": "array",
          "items": {
            "type": "object",
            "additionalProperties": false,
            "required": [
              "ref_id",
              "ref_type"
            ],
            "properties": {
              "ref_id": {
                "type": "string",
                "minLength": 1
              },
              "ref_type": {
                "enum": [
                  "observation",
                  "artifact",
                  "log",
                  "diff",
                  "report"
                ]
              },
              "digest": {
                "type": [
                  "string",
                  "null"
                ],
                "pattern": "^[a-f0-9]{64}$"
              }
            }
          }
        }
      }
    },
    "decision": {
      "type": "object",
      "additionalProperties": false,
      "required": [
        "gate_event_id",
        "decision",
        "stop_reasons",
        "policy_id",
        "policy_version",
        "policy_hash",
        "event_digest"
      ],
      "properties": {
        "gate_event_id": {
          "type": "string",
          "minLength": 1
        },
        "decision": {
          "enum": [
            "ALLOW",
            "BLOCK",
            "ESCALATE"
          ]
        },
        "runtime_interaction": {
          "enum": [
            "NONE",
            "CONFIRM",
            "DENY"
          ]
        },
        "stop_reasons": {
          "type": "array",
          "items": {
            "type": "string",
            "minLength": 1
          },
          "uniqueItems": true
        },
        "policy_id": {
          "type": "string",
          "minLength": 1
        },
        "policy_version": {
          "type": "string",
          "minLength": 1
        },
        "policy_hash": {
          "type": "string",
          "pattern": "^[a-f0-9]{64}$"
        },
        "event_digest": {
          "type": "string",
          "pattern": "^[a-f0-9]{64}$"
        }
      }
    },
    "verification": {
      "type": [
        "object",
        "null"
      ],
      "additionalProperties": false,
      "required": [
        "verification_event_id",
        "status",
        "verifier_id",
        "result_digest",
        "event_digest"
      ],
      "properties": {
        "verification_event_id": {
          "type": "string",
          "minLength": 1
        },
        "status": {
          "enum": [
            "PASS",
            "FAIL",
            "ERROR",
            "SKIPPED"
          ]
        },
        "verifier_id": {
          "type": "string",
          "minLength": 1
        },
        "verifier_version": {
          "type": [
            "string",
            "null"
          ]
        },
        "result_digest": {
          "type": "string",
          "pattern": "^[a-f0-9]{64}$"
        },
        "event_digest": {
          "type": "string",
          "pattern": "^[a-f0-9]{64}$"
        }
      }
    },
    "trace_chain": {
      "type": "array",
      "minItems": 1,
      "items": {
        "type": "object",
        "additionalProperties": false,
        "required": [
          "stage",
          "event_id",
          "event_digest"
        ],
        "properties": {
          "stage": {
            "enum": [
              "DECISION",
              "ACTION",
              "OBSERVATION",
              "VERIFICATION",
              "ARTIFACT"
            ]
          },
          "event_id": {
            "type": "string",
            "minLength": 1
          },
          "event_digest": {
            "type": "string",
            "pattern": "^[a-f0-9]{64}$"
          }
        }
      }
    },
    "complete": {
      "type": "boolean"
    },
    "sensitive_data_redacted": {
      "type": "boolean",
      "default": true
    }
  }
}
